{
  "room_id": "demo_room",
  "version": "1.0",
  "name": "Demo Living Room",
  "units": "meters",
  "up_axis": "Y",
  "created_at": "2026-08-09T09:00:00Z",
  "bounds": { "min": [-2.6, 0.0, -2.2], "max": [2.6, 2.5, 2.2] },
  "floor_y": 0.0,
  "mesh": {
    "url": "/models/demo_room.glb",
    "format": "glb",
    "draco": true,
    "tri_count": 148000,
    "size_bytes": 4210000
  },
  "navmesh": {
    "url": "/api/v1/rooms/demo_room/navmesh",
    "resolution": 0.05,
    "origin": [-2.6, -2.2],
    "width": 104,
    "height": 88
  },
  "robot_dock": [0.0, 0.0, 0.0],
  "objects": [
    {
      "id": "table_01", "label": "table", "position": [0.85, 0.37, -0.90],
      "dimensions": [1.20, 0.74, 0.70], "rotation_y": 0.0, "color": "#9C7A54",
      "confidence": 0.94, "is_obstacle": true, "is_climbable": true,
      "surface_height": 0.74, "source": "detected", "scale_confidence": 1.0
    },
    {
      "id": "chair_01", "label": "chair", "position": [-0.10, 0.45, -0.90],
      "dimensions": [0.45, 0.90, 0.45], "rotation_y": 1.57, "color": "#3D3D45",
      "confidence": 0.91, "is_obstacle": true, "is_climbable": true,
      "surface_height": 0.46, "source": "detected", "scale_confidence": 1.0
    },
    {
      "id": "chair_02", "label": "chair", "position": [1.80, 0.45, -0.90],
      "dimensions": [0.45, 0.90, 0.45], "rotation_y": -1.57, "color": "#3D3D45",
      "confidence": 0.88, "is_obstacle": true, "is_climbable": true,
      "surface_height": 0.46, "source": "detected", "scale_confidence": 1.0
    },
    {
      "id": "sofa_01", "label": "sofa", "position": [-1.60, 0.40, 0.60],
      "dimensions": [1.90, 0.80, 0.85], "rotation_y": 0.0, "color": "#2E4045",
      "confidence": 0.96, "is_obstacle": true, "is_climbable": true,
      "surface_height": 0.44, "source": "detected", "scale_confidence": 1.0
    },
    {
      "id": "shelf_01", "label": "shelf", "position": [0.10, 0.90, 1.95],
      "dimensions": [0.90, 1.80, 0.30], "rotation_y": 0.0, "color": "#6B7280",
      "confidence": 0.89, "is_obstacle": true, "is_climbable": false,
      "surface_height": 1.80, "source": "detected", "scale_confidence": 1.0
    },
    {
      "id": "potted_plant_01", "label": "potted_plant", "position": [2.15, 0.35, -1.60],
      "dimensions": [0.40, 0.70, 0.40], "rotation_y": 0.0, "color": "#4A8C5C",
      "confidence": 0.83, "is_obstacle": true, "is_climbable": false,
      "source": "detected", "scale_confidence": 1.0
    },
    {
      "id": "rug_01", "label": "rug", "position": [0.00, 0.005, 0.20],
      "dimensions": [2.40, 0.01, 1.60], "rotation_y": 0.0, "color": "#B5654A",
      "confidence": 0.78, "is_obstacle": false, "is_climbable": false,
      "source": "detected", "scale_confidence": 1.0
    },
    {
      "id": "tv_01", "label": "tv", "position": [-2.35, 1.10, 0.10],
      "dimensions": [0.08, 0.65, 1.15], "rotation_y": 0.0, "color": "#111827",
      "confidence": 0.95, "is_obstacle": true, "is_climbable": false,
      "source": "detected", "scale_confidence": 1.0
    },
    {
      "id": "lamp_01", "label": "lamp", "position": [-2.10, 0.80, 1.55],
      "dimensions": [0.35, 1.60, 0.35], "rotation_y": 0.0, "color": "#D4B483",
      "confidence": 0.86, "is_obstacle": true, "is_climbable": false,
      "source": "detected", "scale_confidence": 1.0
    }
  ],
  "waypoints": [
    { "name": "reading_corner", "position": [-1.90, 0.0, 1.40] },
    { "name": "window", "position": [2.40, 0.0, 0.00] }
  ]
}
