{
  "room_id": "media_lounge",
  "version": "1.0",
  "name": "Media Lounge",
  "units": "meters",
  "up_axis": "Y",
  "created_at": "2026-08-21T00:00:00Z",
  "bounds": { "min": [-2.6, 0.0, -2.2], "max": [2.6, 2.6, 2.2] },
  "floor_y": 0.0,
  "mesh": {
    "url": "/models/media_lounge.glb",
    "format": "glb",
    "draco": true,
    "tri_count": 0,
    "size_bytes": 0
  },
  "navmesh": {
    "url": "/api/v1/rooms/media_lounge/navmesh",
    "resolution": 0.05,
    "origin": [-2.6, -2.2],
    "width": 104,
    "height": 88
  },
  "robot_dock": [0.0, 0.0, 0.0],
  "objects": [
    {
      "id": "sofa_01", "label": "sofa", "position": [-0.3, 0.40, 1.3],
      "dimensions": [1.90, 0.80, 0.85], "rotation_y": 0.0, "color": "#2A2E35",
      "confidence": 0.96, "is_obstacle": true, "is_climbable": true,
      "surface_height": 0.44, "source": "detected", "scale_confidence": 1.0
    },
    {
      "id": "tv_01", "label": "tv", "position": [-2.55, 1.10, 0.0],
      "dimensions": [0.08, 0.65, 1.15], "rotation_y": 0.0, "color": "#0B0B0D",
      "confidence": 0.95, "is_obstacle": true, "is_climbable": false,
      "source": "detected", "scale_confidence": 1.0
    },
    {
      "id": "cabinet_01", "label": "cabinet", "position": [-2.3, 0.275, 0.0],
      "dimensions": [1.00, 0.55, 0.40], "rotation_y": 1.5708, "color": "#3B3B42",
      "confidence": 0.87, "is_obstacle": true, "is_climbable": false,
      "surface_height": 0.55, "source": "detected", "scale_confidence": 1.0
    },
    {
      "id": "side_table_01", "label": "side_table", "position": [1.6, 0.25, 1.3],
      "dimensions": [0.45, 0.50, 0.45], "rotation_y": 0.0, "color": "#5A4632",
      "confidence": 0.89, "is_obstacle": true, "is_climbable": false,
      "surface_height": 0.50, "source": "detected", "scale_confidence": 1.0
    },
    {
      "id": "lamp_01", "label": "lamp", "position": [2.2, 0.80, -1.6],
      "dimensions": [0.35, 1.60, 0.35], "rotation_y": 0.0, "color": "#D4B483",
      "confidence": 0.87, "is_obstacle": true, "is_climbable": false,
      "source": "detected", "scale_confidence": 1.0
    },
    {
      "id": "rug_01", "label": "rug", "position": [-0.3, 0.005, 0.3],
      "dimensions": [2.40, 0.01, 2.00], "rotation_y": 0.0, "color": "#6B2D3C",
      "confidence": 0.80, "is_obstacle": false, "is_climbable": false,
      "source": "detected", "scale_confidence": 1.0
    },
    {
      "id": "potted_plant_01", "label": "potted_plant", "position": [2.2, 0.35, 1.6],
      "dimensions": [0.40, 0.70, 0.40], "rotation_y": 0.0, "color": "#3F7D4E",
      "confidence": 0.84, "is_obstacle": true, "is_climbable": false,
      "source": "detected", "scale_confidence": 1.0
    },
    {
      "id": "bench_01", "label": "bench", "position": [1.6, 0.225, -0.6],
      "dimensions": [1.10, 0.45, 0.40], "rotation_y": 1.5708, "color": "#2A2E35",
      "confidence": 0.85, "is_obstacle": true, "is_climbable": true,
      "surface_height": 0.45, "source": "detected", "scale_confidence": 1.0
    }
  ],
  "waypoints": [
    { "name": "sofa_seat", "position": [-0.3, 0.0, 1.0] },
    { "name": "tv_wall", "position": [-2.2, 0.0, 0.0] }
  ]
}
