{
  "room_id": "kitchen_dining",
  "version": "1.0",
  "name": "Kitchen & Dining",
  "units": "meters",
  "up_axis": "Y",
  "created_at": "2026-08-21T00:00:00Z",
  "bounds": { "min": [-2.8, 0.0, -2.2], "max": [2.8, 2.6, 2.2] },
  "floor_y": 0.0,
  "mesh": {
    "url": "/models/kitchen_dining.glb",
    "format": "glb",
    "draco": true,
    "tri_count": 0,
    "size_bytes": 0
  },
  "navmesh": {
    "url": "/api/v1/rooms/kitchen_dining/navmesh",
    "resolution": 0.05,
    "origin": [-2.8, -2.2],
    "width": 112,
    "height": 88
  },
  "robot_dock": [0.0, 0.0, 0.0],
  "objects": [
    {
      "id": "fridge_01", "label": "fridge", "position": [-2.35, 0.90, -1.6],
      "dimensions": [0.75, 1.80, 0.70], "rotation_y": 0.0, "color": "#8FBC94",
      "confidence": 0.94, "is_obstacle": true, "is_climbable": false,
      "source": "detected", "scale_confidence": 1.0
    },
    {
      "id": "cabinet_01", "label": "cabinet", "position": [-2.35, 0.275, 0.6],
      "dimensions": [1.00, 0.55, 0.40], "rotation_y": 1.5708, "color": "#DCEFE3",
      "confidence": 0.86, "is_obstacle": true, "is_climbable": false,
      "surface_height": 0.55, "source": "detected", "scale_confidence": 1.0
    },
    {
      "id": "stool_01", "label": "stool", "position": [-1.2, 0.375, -1.6],
      "dimensions": [0.35, 0.75, 0.35], "rotation_y": 0.0, "color": "#2F2F35",
      "confidence": 0.85, "is_obstacle": true, "is_climbable": true,
      "surface_height": 0.75, "source": "detected", "scale_confidence": 1.0
    },
    {
      "id": "stool_02", "label": "stool", "position": [-0.7, 0.375, -1.6],
      "dimensions": [0.35, 0.75, 0.35], "rotation_y": 0.0, "color": "#2F2F35",
      "confidence": 0.85, "is_obstacle": true, "is_climbable": true,
      "surface_height": 0.75, "source": "detected", "scale_confidence": 1.0
    },
    {
      "id": "table_01", "label": "table", "position": [0.8, 0.375, 0.6],
      "dimensions": [1.40, 0.75, 0.85], "rotation_y": 0.0, "color": "#EDE6DA",
      "confidence": 0.94, "is_obstacle": true, "is_climbable": true,
      "surface_height": 0.75, "source": "detected", "scale_confidence": 1.0
    },
    {
      "id": "chair_01", "label": "chair", "position": [0.8, 0.45, -0.1],
      "dimensions": [0.45, 0.90, 0.45], "rotation_y": 3.14159, "color": "#2F2F35",
      "confidence": 0.90, "is_obstacle": true, "is_climbable": true,
      "surface_height": 0.46, "source": "detected", "scale_confidence": 1.0
    },
    {
      "id": "chair_02", "label": "chair", "position": [0.8, 0.45, 1.3],
      "dimensions": [0.45, 0.90, 0.45], "rotation_y": 0.0, "color": "#2F2F35",
      "confidence": 0.90, "is_obstacle": true, "is_climbable": true,
      "surface_height": 0.46, "source": "detected", "scale_confidence": 1.0
    },
    {
      "id": "chair_03", "label": "chair", "position": [-0.25, 0.45, 0.6],
      "dimensions": [0.45, 0.90, 0.45], "rotation_y": 1.5708, "color": "#2F2F35",
      "confidence": 0.90, "is_obstacle": true, "is_climbable": true,
      "surface_height": 0.46, "source": "detected", "scale_confidence": 1.0
    },
    {
      "id": "chair_04", "label": "chair", "position": [1.85, 0.45, 0.6],
      "dimensions": [0.45, 0.90, 0.45], "rotation_y": -1.5708, "color": "#2F2F35",
      "confidence": 0.90, "is_obstacle": true, "is_climbable": true,
      "surface_height": 0.46, "source": "detected", "scale_confidence": 1.0
    },
    {
      "id": "rug_01", "label": "rug", "position": [0.8, 0.005, 0.6],
      "dimensions": [2.20, 0.01, 1.80], "rotation_y": 0.0, "color": "#B98D6F",
      "confidence": 0.80, "is_obstacle": false, "is_climbable": false,
      "source": "detected", "scale_confidence": 1.0
    }
  ],
  "waypoints": [
    { "name": "dining_table", "position": [0.8, 0.0, 0.6] },
    { "name": "counter", "position": [-1.5, 0.0, -1.6] }
  ]
}
